{"$schema":"https://json-schema.org/draft/2020-12/schema","$id":"agentpass.publish-plan.v1","type":"object","additionalProperties":false,"required":["version","kind","organization_id","app_id","release_id","source_bundle_digest","build_receipt_digest","artifact_digest","audience","lifetime_seconds","approval_required","risk_classification","created_at"],"properties":{"version":{"const":1},"kind":{"const":"agentpass.publish-plan"},"organization_id":{"format":"uuid"},"app_id":{"format":"uuid"},"release_id":{"format":"uuid"},"source_bundle_digest":{"pattern":"^[0-9a-f]{64}$"},"build_receipt_digest":{"pattern":"^[0-9a-f]{64}$"},"artifact_digest":{"pattern":"^[0-9a-f]{64}$"},"audience":{"enum":["self","team"]},"lifetime_seconds":{"type":"integer","minimum":0,"maximum":31536000},"approval_required":{"type":"boolean"},"risk_classification":{"enum":["low","medium","high"]},"created_at":{"type":"string"}}}
