{"version":1,"kind":"agentpass.publish-plan","organization_id":"11111111-1111-4111-8111-111111111111","app_id":"22222222-2222-4222-8222-222222222222","release_id":"33333333-3333-4333-8333-333333333333","source_bundle_digest":"aaaaaaaaaaaaaaaaaaaaaaaaaaaaaaaaaaaaaaaaaaaaaaaaaaaaaaaaaaaaaaaa","build_receipt_digest":"bbbbbbbbbbbbbbbbbbbbbbbbbbbbbbbbbbbbbbbbbbbbbbbbbbbbbbbbbbbbbbbb","artifact_digest":"cccccccccccccccccccccccccccccccccccccccccccccccccccccccccccccccc","audience":"self","lifetime_seconds":3600,"approval_required":true,"risk_classification":"low","created_at":"2026-01-01T00:00:00.000Z"}
